{
  "id": "shema",
  "title": "Shema",
  "kind": "prose",
  "sections": [
    {
      "title": "Shema",
      "lines": [
        {
          "hebrew": "שְׁמַע יִשְׂרָאֵל יְיָ אֱלֹהֵינוּ יְיָ אֶחָד׃",
          "translation": "Hear, Israel: the LORD is our God, the LORD is one.",
          "words": [
            {
              "hebrew": "שְׁמַע",
              "meaning": "hear",
              "parts": [
                {
                  "hebrew": "שְׁמַע",
                  "meaning": "hear",
                  "pos": "verb",
                  "binyan": "paal",
                  "form": "imperative",
                  "person": 2,
                  "gender": "masc",
                  "number": "sg"
                }
              ],
              "root": "ש-מ-ע"
            },
            {
              "hebrew": "יִשְׂרָאֵל",
              "meaning": "Israel",
              "parts": [
                {
                  "hebrew": "יִשְׂרָאֵל",
                  "meaning": "Israel",
                  "pos": "name",
                  "gender": "masc",
                  "number": "sg"
                }
              ],
              "root": "ש-ר-ה"
            },
            {
              "hebrew": "יְיָ",
              "meaning": "the LORD",
              "parts": [
                {
                  "hebrew": "יְיָ",
                  "meaning": "the LORD",
                  "pos": "name",
                  "gender": "masc",
                  "number": "sg"
                }
              ],
              "root": "ה-י-ה"
            },
            {
              "hebrew": "אֱלֹהֵינוּ",
              "meaning": "our God",
              "parts": [
                {
                  "hebrew": "אֱלֹהֵי",
                  "meaning": "God of",
                  "pos": "noun",
                  "gender": "masc",
                  "number": "pl",
                  "construct": true
                },
                {
                  "hebrew": "־ֵינוּ",
                  "meaning": "our",
                  "pos": "pronoun-suffix",
                  "person": 1,
                  "number": "pl"
                }
              ],
              "root": "א-ל-ה"
            },
            {
              "hebrew": "יְיָ",
              "meaning": "the LORD",
              "parts": [
                {
                  "hebrew": "יְיָ",
                  "meaning": "the LORD",
                  "pos": "name",
                  "gender": "masc",
                  "number": "sg"
                }
              ],
              "root": "ה-י-ה"
            },
            {
              "hebrew": "אֶחָד",
              "meaning": "one",
              "parts": [
                {
                  "hebrew": "אֶחָד",
                  "meaning": "one",
                  "pos": "numeral"
                }
              ],
              "root": "א-ח-ד"
            }
          ]
        }
      ]
    },
    {
      "title": "Baruch Shem",
      "lines": [
        {
          "hebrew": "בָּרוּךְ שֵׁם כְּבוֹד מַלְכוּתוֹ לְעוֹלָם וָעֶד",
          "translation": "Blessed is the name of His glorious kingdom forever and ever.",
          "words": [
            {
              "hebrew": "בָּרוּךְ",
              "meaning": "blessed",
              "parts": [
                {
                  "hebrew": "בָּרוּךְ",
                  "meaning": "blessed",
                  "pos": "verb",
                  "binyan": "paal",
                  "form": "passive-participle",
                  "gender": "masc",
                  "number": "sg"
                }
              ],
              "root": "ב-ר-ך"
            },
            {
              "hebrew": "שֵׁם",
              "meaning": "the name of",
              "parts": [
                {
                  "hebrew": "שֵׁם",
                  "meaning": "name of",
                  "pos": "noun",
                  "gender": "masc",
                  "number": "sg",
                  "construct": true
                }
              ]
            },
            {
              "hebrew": "כְּבוֹד",
              "meaning": "the glory of",
              "parts": [
                {
                  "hebrew": "כְּבוֹד",
                  "meaning": "glory of",
                  "pos": "noun",
                  "gender": "masc",
                  "number": "sg",
                  "construct": true
                }
              ],
              "root": "כ-ב-ד"
            },
            {
              "hebrew": "מַלְכוּתוֹ",
              "meaning": "His kingdom",
              "parts": [
                {
                  "hebrew": "מַלְכוּת",
                  "meaning": "kingdom of",
                  "pos": "noun",
                  "gender": "fem",
                  "number": "sg",
                  "construct": true
                },
                {
                  "hebrew": "־וֹ",
                  "meaning": "His",
                  "pos": "pronoun-suffix",
                  "person": 3,
                  "gender": "masc",
                  "number": "sg"
                }
              ],
              "root": "מ-ל-ך"
            },
            {
              "hebrew": "לְעוֹלָם",
              "meaning": "forever",
              "parts": [
                {
                  "hebrew": "לְ־",
                  "meaning": "for",
                  "pos": "preposition"
                },
                {
                  "hebrew": "עוֹלָם",
                  "meaning": "eternity",
                  "pos": "noun",
                  "gender": "masc",
                  "number": "sg"
                }
              ],
              "root": "ע-ל-ם"
            },
            {
              "hebrew": "וָעֶד",
              "meaning": "and ever",
              "parts": [
                {
                  "hebrew": "וָ־",
                  "meaning": "and",
                  "pos": "conjunction"
                },
                {
                  "hebrew": "עֶד",
                  "meaning": "perpetuity",
                  "pos": "noun",
                  "gender": "masc",
                  "number": "sg"
                }
              ]
            }
          ]
        }
      ]
    },
    {
      "title": "V'ahavta",
      "lines": [
        {
          "hebrew": "וְאָהַבְתָּ אֵת יְיָ אֱלֹהֶיךָ בְּכָל־לְבָבְךָ וּבְכָל־נַפְשְׁךָ וּבְכָל־מְאֹדֶךָ׃",
          "translation": "And you shall love the LORD your God with all your heart, with all your soul and with all your might.",
          "words": [
            {
              "hebrew": "וְאָהַבְתָּ",
              "meaning": "and you shall love",
              "parts": [
                {
                  "hebrew": "וְ־",
                  "meaning": "and",
                  "pos": "conjunction"
                },
                {
                  "hebrew": "אָהַבְתָּ",
                  "meaning": "you shall love",
                  "pos": "verb",
                  "binyan": "paal",
                  "form": "past",
                  "person": 2,
                  "gender": "masc",
                  "number": "sg"
                }
              ],
              "root": "א-ה-ב"
            },
            {
              "hebrew": "אֵת",
              "meaning": "(marks the direct object)",
              "parts": [
                {
                  "hebrew": "אֵת",
                  "meaning": "(marks the direct object)",
                  "pos": "particle"
                }
              ]
            },
            {
              "hebrew": "יְיָ",
              "meaning": "the LORD",
              "parts": [
                {
                  "hebrew": "יְיָ",
                  "meaning": "the LORD",
                  "pos": "name",
                  "gender": "masc",
                  "number": "sg"
                }
              ],
              "root": "ה-י-ה"
            },
            {
              "hebrew": "אֱלֹהֶיךָ",
              "meaning": "your God",
              "parts": [
                {
                  "hebrew": "אֱלֹהֵי",
                  "meaning": "God of",
                  "pos": "noun",
                  "gender": "masc",
                  "number": "pl",
                  "construct": true
                },
                {
                  "hebrew": "־ֶיךָ",
                  "meaning": "your",
                  "pos": "pronoun-suffix",
                  "person": 2,
                  "gender": "masc",
                  "number": "sg"
                }
              ],
              "root": "א-ל-ה"
            },
            {
              "hebrew": "בְּכָל־",
              "meaning": "with all of",
              "parts": [
                {
                  "hebrew": "בְּ־",
                  "meaning": "with",
                  "pos": "preposition"
                },
                {
                  "hebrew": "כָּל־",
                  "meaning": "all of",
                  "pos": "noun",
                  "gender": "masc",
                  "number": "sg",
                  "construct": true
                }
              ],
              "root": "כ-ל-ל"
            },
            {
              "hebrew": "לְבָבְךָ",
              "meaning": "your heart",
              "parts": [
                {
                  "hebrew": "לְבַב",
                  "meaning": "heart of",
                  "pos": "noun",
                  "gender": "masc",
                  "number": "sg",
                  "construct": true
                },
                {
                  "hebrew": "־ְךָ",
                  "meaning": "your",
                  "pos": "pronoun-suffix",
                  "person": 2,
                  "gender": "masc",
                  "number": "sg"
                }
              ],
              "root": "ל-ב-ב"
            },
            {
              "hebrew": "וּבְכָל־",
              "meaning": "and with all of",
              "parts": [